{
  "schema": "handoff.task.v1",
  "id": "HFTASK-0054",
  "title": "Issue #71.2: confirm ledger-path/member override fully covers member Tier-A (no per-repo ledger.db)",
  "status": "backlog",
  "priority": "P2",
  "objective": "GitHub #71 item 2 / envctl FINDING-0002: `hf` was strictly CWD-relative (no --ledger/HANDOFF_LEDGER), so a member repo could not render Tier-A against the shared FLEET ledger ($META_ROOT/.handoff/ledger.db) without a per-repo ledger.db that ADR-0004 forbids. `hf fleet render <member>` (PR #17, 1adbb13) partially addressed this. CONFIRM it (and add an explicit `--ledger`/HANDOFF_LEDGER override if gaps remain) fully covers member packet rendering AND seed/mint against the shared FLEET ledger with ZERO per-repo ledger.db, so envctl renders its Tier-A kernel-rendered (not git-text-only fallback) and passes its p7 gate. Verification-first: prove coverage end-to-end from a member CWD, build the override only where uncovered.",
  "path_scope": [
    "spike/**",
    "handoff/**"
  ],
  "acceptance_criteria": [
    "Issue #71.2: confirm ledger-path/member override fully covers member Tier-A (no per-repo ledger.db): implemented + cargo test green + checkpointed"
  ],
  "test_commands": [
    "cargo test"
  ],
  "dependencies": [
    "HFTASK-0034"
  ],
  "blocked_by": [],
  "allows_network": false,
  "allows_dependency_addition": true,
  "correlation_id": "handoff-buildout",
  "role": "implementer",
  "intent_lock": {
    "objective_hash": "blake3:a2ae18dcfcfd043bdcfadadd7e65685febb68f128bb848788f1d726a555bf65e",
    "path_scope_hash": "blake3:2ffa7a442ff7ccdaf5c3a7ddad4cdf9b388fc5ed01dde27996a7c9f7d0e2f221",
    "acceptance_hash": "blake3:ae04ace1a6a7bd605d967bceb0f3fb097214f806c21f1aecf5f75db090f9045a",
    "constraint_hash": "blake3:6046b0d82db5de639c14da39c294062b581bc1555cf666738d6817f706aea560",
    "northstar_revision": "blake3:aa161a7ffed934d6be955de6b80125bb77bddad718465077b94f9c73e197df70"
  }
}