{
  "schema": "handoff.task.v1",
  "id": "HFTASK-0076",
  "title": "ADR-0018 D11: all PRs->develop; hands-off develop->trunk auto-promotion + master/main reconcile",
  "status": "backlog",
  "priority": "P1",
  "objective": "ADR-0018 D11: fix/replace the `sync-master.yml` stall so develop promotes to trunk AUTOMATICALLY on green with NO manual `gh api` ff. Reconcile the trunk NAME: directive says `main`, repo uses `master` — standardize on `main` (or keep `master` with `main` as the documented alias) across `policy.toml`, `.github/workflows/*`, and the docs, ONE decision applied everywhere. The pipeline is fixed: branch off develop -> PR --base develop -> auto-promote on green.",
  "path_scope": [
    "spike/**",
    "handoff/**"
  ],
  "acceptance_criteria": [
    "ADR-0018 D11: all PRs->develop; hands-off develop->trunk auto-promotion + master/main reconcile: implemented + cargo test green + checkpointed"
  ],
  "test_commands": [
    "cargo test"
  ],
  "dependencies": [],
  "blocked_by": [],
  "allows_network": false,
  "allows_dependency_addition": true,
  "correlation_id": "handoff-buildout",
  "role": "implementer",
  "intent_lock": {
    "objective_hash": "blake3:4ee59d805549928c35424c97d1c21331a1a7945992aebb63e011bd322d78bc75",
    "path_scope_hash": "blake3:2ffa7a442ff7ccdaf5c3a7ddad4cdf9b388fc5ed01dde27996a7c9f7d0e2f221",
    "acceptance_hash": "blake3:099a1b08b9cc77f5ed8a042a76800cc665258d0ece44f0392848c783752d6d65",
    "constraint_hash": "blake3:5864f0ba73a4e068f3203ef3eb5fbabb5f4cb3ca7f28f6110f904a12a2ae0ac3",
    "northstar_revision": "blake3:aa161a7ffed934d6be955de6b80125bb77bddad718465077b94f9c73e197df70"
  }
}