{
  "schema": "handoff.task.v1",
  "id": "TASK-73ACBF-0001",
  "title": "[bundle] Sync final handoff packet/active derived views after PR 231 ",
  "status": "done",
  "priority": "P1",
  "objective": "Sync final handoff packet/active derived views after PR 231 merge so post-merge resume state is committed and drift-clean. Scope covers only handoff protocol artifacts generated by prompt-hub/handoff for this packet sync.",
  "path_scope": [
    ".handoff/**"
  ],
  "acceptance_criteria": [
    "New tests assert the target behavior and fail before / pass after the change; `cargo test` is green.",
    "Drift audit passes: no out-of-scope write (edits stay within path_scope) and the intent_lock is unchanged."
  ],
  "test_commands": [
    "cargo test"
  ],
  "dependencies": [],
  "blocked_by": [],
  "allows_network": false,
  "allows_dependency_addition": false,
  "correlation_id": "vibe-894bef46911bdda0-1782594467375147057",
  "role": null,
  "intent_lock": {
    "objective_hash": "blake3:97b44f363c16b6b9ea43b7f71e05a2b0b62bc13e645098511f36f0153ca18ef8",
    "path_scope_hash": "blake3:32c7b3bfd6fa8d18102b3d53b57432518b3c19009c499ea7cb6dcea0ab10d3f1",
    "acceptance_hash": "blake3:e7100f7e3dbb57ed0c4f2b3fa2f31f18b97ef80dcfe9628e7b9ce6a6684274eb"
  }
}