{
  "schema": "handoff.task.v1",
  "id": "HFTASK-0051",
  "title": "PRD handoffd daemon (heartbeat + watch process)",
  "status": "backlog",
  "priority": "P2",
  "objective": "PRD §6/§7.2 architecture has a Daemon node that is unrealized — there is no handoffd process. Build the daemon: lease-heartbeat ticker, ledger tail/watch feed (the read-model behind hf watch / Mission Control), and a supervised resume hook, so the loop has a live process, not only one-shot CLI invocations.",
  "path_scope": [
    "spike/**",
    "handoff/**"
  ],
  "acceptance_criteria": [
    "PRD handoffd daemon (heartbeat + watch process): implemented + cargo test green + checkpointed"
  ],
  "test_commands": [
    "cargo test"
  ],
  "dependencies": [
    "HFTASK-0007"
  ],
  "blocked_by": [],
  "allows_network": false,
  "allows_dependency_addition": true,
  "correlation_id": "handoff-buildout",
  "role": "implementer",
  "intent_lock": {
    "objective_hash": "blake3:9225e987f064e9cdbcc9730966f472957b9f8d8e008c28124df70474d8798c9d",
    "path_scope_hash": "blake3:2ffa7a442ff7ccdaf5c3a7ddad4cdf9b388fc5ed01dde27996a7c9f7d0e2f221",
    "acceptance_hash": "blake3:fdfad19a828916ca38029288604943625b4ce2b03b6070883b7c922525ca2f8a"
  }
}